{
  "log": {
    "loglevel": "info",
    "dnsLog": false,
    "access": "/var/log/xray-node/access.log",
    "error": "/var/log/xray-node/access.log"
  },
  "dns": {
    "servers": ["https://1.1.1.1/dns-query"],
    "queryStrategy": "UseIP"
  },
  "api": {
    "tag": "api",
    "listen": "127.0.0.1:32998",
    "services": ["HandlerService", "LoggerService", "StatsService", "ReflectionService"]
  },
  "stats": {},

  "policy": {
    "levels": {
      "0": {
        "statsUserUplink": true,
        "statsUserDownlink": true,
        "statsUserOnline": true
      }
    },
    "system": {
      "statsInboundUplink": true,
      "statsInboundDownlink": true,
      "statsOutboundUplink": true,
      "statsOutboundDownlink": true
    }
  },

  "inbounds": [
    {
      "tag": "vless-tcp-reality",
      "listen": "0.0.0.0",
      "port": 10443,
      "protocol": "vless",
      "settings": {
        "clients": [],
        "decryption": "none"
      },
      "streamSettings": {
        "network": "tcp",
        "security": "reality",

        "realitySettings": {
          "dest": "dl.google.com:443",
          "serverNames": ["dl.google.com"],
          "privateKey": "『PRIVATE KEY EXAMPLE』(generate pair via xray x25519)",
          "shortIds": [""],
          "xver": 0,
          "show": false
        }
      },
      "sniffing": {
        "enabled": true,
        "destOverride": ["http", "tls", "quic"],
        "routeOnly": true
      }
    }
  ],
  "outbounds": [
    {
      "protocol": "freedom",
      "tag": "direct"
    }
  ]
}
